{
  "$schema": "http://json-schema.org/draft-07/schema#",
  "$id": "https://w-model-dev/schemas/maturity.schema.json",
  "description": "成熟度等级（maturity.json）结构 schema，对应 maturity-logic.ts R1-R8 schema/level/history/降级/链一致性（R7 status 转移、R8 降级须 human 授权）校验（43.0.0 A4：unlockConditions 及 downgradeTriggers.budgetBurnRateExceeded / .checkpointRejectionStreak 预留死字段已删除，downgradeTriggers 本身保留 operationalFailureStreak + userRequested；level 变更须 role=human 签名链审批，见 signature-chain-logic verifyMaturityApproval）",
  "title": "MaturityConfig",
  "type": "object",
  "additionalProperties": false,
  "required": ["schemaVersion", "projectId", "level", "leveledUpAt", "history", "downgradeTriggers"],
  "properties": {
    "schemaVersion": { "description": "Schema 版本，当前固定为 1.0", "type": "string", "pattern": "^1\\.0$" },
    "projectId": { "description": "项目 ID（与 project.json 一致）", "type": "string", "minLength": 1 },
    "level": {
      "description": "当前成熟度级别：L0=初始级，决策型/操作型 CHECKPOINT 均需用户参与 / L1=操作型 CHECKPOINT 自动放行 / L2=事件驱动循环激活 / L3=低介入自主（高风险路径仍强制决策型 CHECKPOINT）；R2 校验须为 L0/L1/L2/L3 之一；R6 校验末条 history.to 不低于 level（降级后低于末条合法，只锁伪造升级）；L0/L1 的 TLA+/BDD 豁免须 role=human / targetKind=maturity 签名链审批（check-artifact-gate 消费前校验，无链即不豁免）",
      "enum": ["L0", "L1", "L2", "L3"]
    },
    "leveledUpAt": {
      "description": "升级到此级别的时间（ISO 8601；R4 校验不得早于 project.createdAt）",
      "type": "string",
      "format": "date-time"
    },
    "history": {
      "description": "升级历史数组（每次升级 append 一条；只承载升级链，降级走 human 审批链不记 history；R4 校验每条 at 不得早于 project.createdAt；R6 校验 from==上一条 to / to 严格高于 from / 末条 to 不低于 level——降级后 level 低于末条合法，只锁伪造升级）",
      "type": "array",
      "items": {
        "description": "单条成熟度升级历史（LevelHistory：from + to + at + reason）",
        "type": "object",
        "additionalProperties": false,
        "required": ["from", "to", "at", "reason"],
        "properties": {
          "from": {
            "description": "升级前级别（L0/L1/L2/L3；R6 校验首条外须等于上一条 to）",
            "enum": ["L0", "L1", "L2", "L3"]
          },
          "to": {
            "description": "升级后级别（L0/L1/L2/L3；R6 校验须严格高于 from，降级形态非法）",
            "enum": ["L0", "L1", "L2", "L3"]
          },
          "at": {
            "description": "升级时间（ISO 8601；R4 校验不得早于 project.createdAt；verifyMaturityApproval 校验 human 审批不得早于末条变更）",
            "type": "string",
            "format": "date-time"
          },
          "reason": {
            "description": "升级原因（如解锁条件全部达标——解锁条件现仅为文档层语义，无机器校验）",
            "type": "string",
            "minLength": 1
          }
        }
      }
    },
    "downgradeTriggers": {
      "description": "降级触发条件（满足即触发降级评估，run-log append 降级记录；降级须 human 授权——43.1.0 决策 #2，原「自动降级回 L0」语义作废，check-maturity R8 无审批链条目即 blocking；43.0.0 A4 起仅 operationalFailureStreak + userRequested，两个预留死字段已删除）",
      "type": "object",
      "additionalProperties": false,
      "required": ["operationalFailureStreak", "userRequested"],
      "properties": {
        "operationalFailureStreak": {
          "description": "连续 O 系列失败模式命中阈值（命中 ≥ 此值触发降级评估并暂停，须 human 授权方可降级；R5 校验比对 run-log O1-O6 命中计数）",
          "type": "integer",
          "minimum": 0
        },
        "userRequested": {
          "description": "用户显式请求降级标记（true 时更新 maturity.json.level=L0；降级不记 history 升级链，R6 只承载升级）",
          "type": "boolean"
        }
      }
    }
  }
}
