{
  "schemaVersion": "1.0",
  "projectId": "shell-agent-wm-001",
  "level": "L1",
  "leveledUpAt": "2026-07-23T18:00:00Z",
  "history": [
    {
      "at": "2026-07-23T18:00:00Z",
      "from": "L0",
      "to": "L1",
      "reason": "3 阶段稳定完成"
    }
  ],
  "downgradeTriggers": {
    "operationalFailureStreak": 3,
    "userRequested": false
  }
}
